{
  "slug": "carpenter-goods",
  "name": "carpenter's goods",
  "status": "in_progress",
  "product": {
    "purpose": "Prepare Etsy and Shopify product drafts and track agreed commissions from owner-exported sales.",
    "channels": [
      "Etsy",
      "Shopify site with local pickup"
    ],
    "publication": "Manual publication only after owner approval; no platform write connector is used.",
    "billing": "Commission per sale, with the rate agreed in writing with the carpenter."
  },
  "blocks": [],
  "block_functions": [],
  "flows": [
    "carpenter-prepare-listing",
    "carpenter-track-commissions"
  ],
  "schedules": [],
  "secrets_needed": [],
  "your_steps": [
    {
      "id": "agree-commission",
      "title": "Agree the commission in writing",
      "when": "Before preparing the launch files or tracking sales",
      "detail": "Fill and review agreement/commission-agreement.md with the carpenter, including the eligible order amount and treatment of tax, shipping, discounts, refunds, and fees. Both people sign it themselves. Also provide maker-confirmed product facts, local photos, three current source-linked completed-sale comparisons, and owner-exported Etsy/Shopify order CSVs when available. The legacy paid-sales.json input is also supported by the CLI. Glacier does not sign the agreement or connect to either shop.",
      "links": [
        "https://www.etsy.com/your/shops/me/dashboard"
      ]
    },
    {
      "id": "approve-first-listing",
      "title": "Review and publish the first listing",
      "when": "After a draft is prepared",
      "detail": "Review the prepared Etsy and Shopify drafts, photos, facts, comparable sales and price. Before physical-goods sales, check whether the business meets Georgia's dealer definition and, if so, register for Sales & Use Tax through GTC; registration is free. DOR says online registration is available through GTC and electronic filing is free. Use Georgia Form ST-5 only for qualifying tax-exempt wholesale purchases for resale, not personal-use purchases. If the drafts and setup are correct, publish manually in the shop(s) yourself. Glacier does not create accounts or publish listings.",
      "links": [
        "https://www.etsy.com/your/shops/me/dashboard",
        "https://admin.shopify.com/",
        "https://dor.georgia.gov/tax-registration",
        "https://dor.georgia.gov/how-register-sales-and-use-tax-account",
        "https://dor.georgia.gov/about-georgia-tax-center",
        "https://dor.georgia.gov/document/form/st-5-sales-tax-certificate-exemption/download"
      ]
    }
  ],
  "launch_gates": [
    "Owner agrees commission terms in writing with the carpenter.",
    "Owner approves the first product listing before manual publication.",
    "Any paid production or order is approved by the owner."
  ],
  "dry_run_env_id": "carpenter-prepare-listing"
}
