{
  "slug": "recall-actor",
  "name": "Product Recall Checker (CPSC, NHTSA, FDA)",
  "status": "ready",
  "flows": [
    "recall-actor-owner-publish"
  ],
  "secrets_needed": [],
  "your_steps": [
    {
      "id": "publish-existing-actor",
      "title": "connect, build, price, and publish existing Actor",
      "when": "In one sitting after this card is integrated into glacier-final",
      "detail": "Use the Apify account and Store steps once in ventures/apify-portfolio/PUBLISH-CHECKLIST.md. Update existing Actor Fpv0233nJE7VxcgfN; connect the exact Git URL, build, set recall-check to $0.01, configure no automatic start/dataset-item charge, review and publish it yourself. Payout verification is one-time across all six Actors.",
      "links": [
        "https://console.apify.com/account/integrations",
        "https://console.apify.com/actors/Fpv0233nJE7VxcgfN"
      ]
    }
  ],
  "product": {
    "purpose": "Publish Product Recall Checker (CPSC, NHTSA, FDA) as a pay-per-event Apify Store Actor.",
    "actor_name": "product-recall-checker",
    "existing_actor_id": "Fpv0233nJE7VxcgfN",
    "seo_description": "product recall search CPSC NHTSA FDA UPC barcode model",
    "pricing": {
      "model": "pay_per_event",
      "event": "recall-check",
      "price_usd": 0.01,
      "platform_usage_included": true
    }
  }
}
